{
  "$schema": "http://json-schema.org/draft-07/schema#",
  "$id": "https://forgewright.local/schemas/docs-project-state.schema.json",
  "title": "Forgewright Docs Project State",
  "$comment": "This draft-07 document validates portable structure. Cross-record semantics (unique IDs by key, reference integrity, lifecycle agreement, valid timestamp ordering, and filesystem containment) MUST also pass the Forgewright CLI semantic validator through `forge docs doctor --strict` or `forge docs gate`.",
  "x-forgewright-semantic-validation": {
    "required": true,
    "commands": ["forge docs doctor --strict", "forge docs gate"]
  },
  "type": "object",
  "additionalProperties": false,
  "required": [
    "schema_version",
    "project",
    "structure",
    "roadmap",
    "flows",
    "backlog",
    "status"
  ],
  "properties": {
    "schema_version": { "const": 1 },
    "project": { "$ref": "#/definitions/project" },
    "structure": { "$ref": "#/definitions/structure" },
    "roadmap": {
      "type": "array",
      "items": { "$ref": "#/definitions/roadmapItem" },
      "uniqueItems": true
    },
    "flows": {
      "type": "array",
      "items": { "$ref": "#/definitions/flow" },
      "uniqueItems": true
    },
    "backlog": {
      "type": "array",
      "items": { "$ref": "#/definitions/backlogItem" },
      "uniqueItems": true
    },
    "status": { "$ref": "#/definitions/status" }
  },
  "definitions": {
    "id": {
      "type": "string",
      "pattern": "^[a-z0-9]+(?:-[a-z0-9]+)*$"
    },
    "text": {
      "type": "string",
      "minLength": 1
    },
    "relativePath": {
      "type": "string",
      "minLength": 1,
      "pattern": "^(?!/)(?![A-Za-z]:)(?!.*\\\\)(?!.*(?:^|/)\\.\\.(?:/|$)).+$"
    },
    "dateTime": {
      "type": "string",
      "format": "date-time",
      "pattern": "^\\d{4}-\\d{2}-\\d{2}T\\d{2}:\\d{2}:\\d{2}(?:\\.\\d+)?(?:Z|[+-]\\d{2}:\\d{2})$"
    },
    "date": {
      "type": "string",
      "format": "date",
      "pattern": "^\\d{4}-\\d{2}-\\d{2}$"
    },
    "docRef": {
      "type": "object",
      "additionalProperties": false,
      "required": ["path"],
      "properties": {
        "path": { "$ref": "#/definitions/relativePath" },
        "anchor": { "$ref": "#/definitions/text" }
      }
    },
    "project": {
      "type": "object",
      "additionalProperties": false,
      "required": ["summary", "product_type", "lifecycle"],
      "properties": {
        "summary": { "$ref": "#/definitions/text" },
        "product_type": {
          "type": "string",
          "enum": ["product", "game", "library", "service", "tooling", "other"]
        },
        "lifecycle": {
          "type": "string",
          "enum": ["planning", "active", "paused", "archived", "completed"]
        }
      }
    },
    "root": {
      "type": "object",
      "additionalProperties": false,
      "required": ["id", "path", "kind", "purpose", "owner"],
      "properties": {
        "id": { "$ref": "#/definitions/id" },
        "path": { "$ref": "#/definitions/relativePath" },
        "kind": { "$ref": "#/definitions/text" },
        "purpose": { "$ref": "#/definitions/text" },
        "owner": { "$ref": "#/definitions/text" }
      }
    },
    "dependency": {
      "type": "object",
      "additionalProperties": false,
      "required": ["from", "to", "type"],
      "properties": {
        "from": { "$ref": "#/definitions/id" },
        "to": { "$ref": "#/definitions/id" },
        "type": { "$ref": "#/definitions/text" }
      }
    },
    "structure": {
      "type": "object",
      "additionalProperties": false,
      "required": ["roots", "dependencies"],
      "properties": {
        "roots": {
          "type": "array",
          "minItems": 1,
          "items": { "$ref": "#/definitions/root" },
          "uniqueItems": true
        },
        "dependencies": {
          "type": "array",
          "items": { "$ref": "#/definitions/dependency" }
        }
      }
    },
    "priority": {
      "type": "string",
      "enum": ["low", "medium", "high", "critical"]
    },
    "roadmapItem": {
      "type": "object",
      "additionalProperties": false,
      "required": [
        "id",
        "title",
        "status",
        "priority",
        "owner",
        "target_date",
        "depends_on",
        "references"
      ],
      "properties": {
        "id": { "$ref": "#/definitions/id" },
        "title": { "$ref": "#/definitions/text" },
        "status": {
          "type": "string",
          "enum": [
            "proposed",
            "planned",
            "in_progress",
            "blocked",
            "done",
            "cancelled"
          ]
        },
        "priority": { "$ref": "#/definitions/priority" },
        "owner": { "$ref": "#/definitions/text" },
        "target_date": {
          "anyOf": [{ "$ref": "#/definitions/date" }, { "type": "null" }]
        },
        "depends_on": {
          "type": "array",
          "items": { "$ref": "#/definitions/id" }
        },
        "references": {
          "type": "array",
          "items": { "$ref": "#/definitions/docRef" }
        }
      }
    },
    "flowStep": {
      "type": "object",
      "additionalProperties": false,
      "required": ["id", "name", "actor", "inputs", "outputs", "references"],
      "properties": {
        "id": { "$ref": "#/definitions/id" },
        "name": { "$ref": "#/definitions/text" },
        "actor": { "$ref": "#/definitions/text" },
        "inputs": {
          "type": "array",
          "minItems": 1,
          "items": { "$ref": "#/definitions/text" }
        },
        "outputs": {
          "type": "array",
          "minItems": 1,
          "items": { "$ref": "#/definitions/text" }
        },
        "references": {
          "type": "array",
          "items": { "$ref": "#/definitions/docRef" }
        }
      }
    },
    "flow": {
      "type": "object",
      "additionalProperties": false,
      "required": ["id", "title", "status", "trigger", "steps"],
      "properties": {
        "id": { "$ref": "#/definitions/id" },
        "title": { "$ref": "#/definitions/text" },
        "status": {
          "type": "string",
          "enum": ["draft", "active", "deprecated"]
        },
        "trigger": { "$ref": "#/definitions/text" },
        "steps": {
          "type": "array",
          "minItems": 1,
          "items": { "$ref": "#/definitions/flowStep" },
          "uniqueItems": true
        }
      }
    },
    "backlogItem": {
      "type": "object",
      "additionalProperties": false,
      "required": [
        "id",
        "title",
        "type",
        "status",
        "priority",
        "owner",
        "acceptance",
        "references"
      ],
      "properties": {
        "id": { "$ref": "#/definitions/id" },
        "title": { "$ref": "#/definitions/text" },
        "type": {
          "type": "string",
          "enum": ["feature", "bug", "task", "research", "technical_debt"]
        },
        "status": {
          "type": "string",
          "enum": [
            "proposed",
            "ready",
            "in_progress",
            "blocked",
            "done",
            "cancelled"
          ]
        },
        "priority": { "$ref": "#/definitions/priority" },
        "owner": { "$ref": "#/definitions/text" },
        "acceptance": {
          "type": "array",
          "minItems": 1,
          "items": { "$ref": "#/definitions/text" }
        },
        "references": {
          "type": "array",
          "items": { "$ref": "#/definitions/docRef" }
        }
      }
    },
    "blocker": {
      "type": "object",
      "additionalProperties": false,
      "required": ["id", "title", "owner"],
      "properties": {
        "id": { "$ref": "#/definitions/id" },
        "title": { "$ref": "#/definitions/text" },
        "owner": { "$ref": "#/definitions/text" }
      }
    },
    "risk": {
      "type": "object",
      "additionalProperties": false,
      "required": ["id", "title", "owner", "mitigation"],
      "properties": {
        "id": { "$ref": "#/definitions/id" },
        "title": { "$ref": "#/definitions/text" },
        "owner": { "$ref": "#/definitions/text" },
        "mitigation": { "$ref": "#/definitions/text" }
      }
    },
    "nextAction": {
      "type": "object",
      "additionalProperties": false,
      "required": ["id", "title", "owner", "due_date"],
      "properties": {
        "id": { "$ref": "#/definitions/id" },
        "title": { "$ref": "#/definitions/text" },
        "owner": { "$ref": "#/definitions/text" },
        "due_date": {
          "anyOf": [{ "$ref": "#/definitions/date" }, { "type": "null" }]
        }
      }
    },
    "status": {
      "type": "object",
      "additionalProperties": false,
      "required": [
        "lifecycle",
        "health",
        "phase",
        "summary",
        "updated_at",
        "blockers",
        "risks",
        "next_actions",
        "next_update_at"
      ],
      "properties": {
        "lifecycle": {
          "type": "string",
          "enum": ["planning", "active", "paused", "archived", "completed"]
        },
        "health": {
          "type": "string",
          "enum": ["on_track", "at_risk", "blocked", "unknown"]
        },
        "phase": { "$ref": "#/definitions/text" },
        "summary": { "$ref": "#/definitions/text" },
        "updated_at": { "$ref": "#/definitions/dateTime" },
        "blockers": {
          "type": "array",
          "items": { "$ref": "#/definitions/blocker" },
          "uniqueItems": true
        },
        "risks": {
          "type": "array",
          "items": { "$ref": "#/definitions/risk" },
          "uniqueItems": true
        },
        "next_actions": {
          "type": "array",
          "items": { "$ref": "#/definitions/nextAction" },
          "uniqueItems": true
        },
        "next_update_at": {
          "anyOf": [{ "$ref": "#/definitions/dateTime" }, { "type": "null" }]
        }
      }
    }
  }
}
