{
  "schema_version": 1,
  "project": {
    "summary": "Forgewright is a local-first, provider-neutral autonomous product-engineering system that preserves an evidence-backed engineering pipeline while adding product intent, environment interaction, outcome verification, and gated learning across web, app, and game.",
    "product_type": "tooling",
    "lifecycle": "active"
  },
  "structure": {
    "roots": [
      {
        "id": "kernel",
        "path": "kernel",
        "kind": "policy-kernel",
        "purpose": "Canonical boot, solve, verification, clarification, audit, and escalation contracts.",
        "owner": "Forgewright maintainers"
      },
      {
        "id": "skills",
        "path": "skills",
        "kind": "capability-library",
        "purpose": "Senior specialist skills and shared pipeline protocols used by routed roles.",
        "owner": "Forgewright maintainers"
      },
      {
        "id": "mcp",
        "path": "mcp",
        "kind": "runtime",
        "purpose": "Canonical TypeScript MCP runtime, middleware, tools, and runtime tests.",
        "owner": "Runtime maintainers"
      },
      {
        "id": "cli",
        "path": "src/cli",
        "kind": "command-line-interface",
        "purpose": "Project initialization, onboarding, Docs Hub, and local operator commands.",
        "owner": "CLI maintainers"
      },
      {
        "id": "scripts",
        "path": "scripts",
        "kind": "automation",
        "purpose": "Provider-neutral local CI, release, setup, synchronization, and runtime automation.",
        "owner": "DevOps maintainers"
      },
      {
        "id": "schemas",
        "path": "schemas",
        "kind": "contracts",
        "purpose": "Machine-readable public and internal data contracts.",
        "owner": "Architecture maintainers"
      },
      {
        "id": "docs",
        "path": "docs",
        "kind": "documentation",
        "purpose": "Product, architecture, roadmap, workflow, operations, and migration sources rendered by Docs Hub.",
        "owner": "Documentation maintainers"
      },
      {
        "id": "tests",
        "path": "tests",
        "kind": "verification",
        "purpose": "Repository-level deterministic unit, integration, contract, hook, and release verification.",
        "owner": "QA maintainers"
      },
      {
        "id": "templates",
        "path": "templates",
        "kind": "distribution",
        "purpose": "Project-owned templates installed or synchronized into supported client workspaces.",
        "owner": "Forgewright maintainers"
      }
    ],
    "dependencies": [
      {
        "from": "skills",
        "to": "kernel",
        "type": "consumes pipeline policy"
      },
      {
        "from": "mcp",
        "to": "schemas",
        "type": "validates runtime contracts"
      },
      {
        "from": "cli",
        "to": "schemas",
        "type": "validates CLI data contracts"
      },
      {
        "from": "scripts",
        "to": "tests",
        "type": "executes local verification"
      },
      {
        "from": "templates",
        "to": "kernel",
        "type": "distributes generated entry contracts"
      }
    ]
  },
  "roadmap": [
    {
      "id": "docs-continuity",
      "title": "Enforce continuously updated project intelligence and generated HTML/CSS documentation",
      "status": "in_progress",
      "priority": "critical",
      "owner": "Forgewright maintainers",
      "target_date": null,
      "depends_on": [],
      "references": [
        {
          "path": "docs/adr/ADR-011-central-docs-hub.md"
        },
        {
          "path": "docs/guides/docs-hub.md"
        }
      ]
    },
    {
      "id": "rule-context-lifecycle",
      "title": "Keep canonical rule context visible across supported agent runtimes without blocking normal work",
      "status": "done",
      "priority": "critical",
      "owner": "Runtime maintainers",
      "target_date": null,
      "depends_on": [
        "docs-continuity"
      ],
      "references": [
        {
          "path": "docs/guides/docs-hub.md",
          "anchor": "rule-context-and-stop-lifecycle"
        }
      ]
    },
    {
      "id": "documentation-governance",
      "title": "Prevent duplicate, out-of-scope, transient, and stale project documentation",
      "status": "done",
      "priority": "critical",
      "owner": "Documentation maintainers",
      "target_date": null,
      "depends_on": [
        "docs-continuity"
      ],
      "references": [
        {
          "path": "skills/_shared/protocols/documentation-governance.md"
        },
        {
          "path": "docs/guides/docs-hub.md",
          "anchor": "documentation-write-governance"
        }
      ]
    },
    {
      "id": "bounded-peer-collaboration",
      "title": "Provide parent-mediated bounded advisory exchange between specialist roles",
      "status": "done",
      "priority": "high",
      "owner": "Orchestration maintainers",
      "target_date": null,
      "depends_on": [],
      "references": [
        {
          "path": "docs/adr/ADR-012-bounded-peer-collaboration.md"
        },
        {
          "path": "docs/guides/peer-collaboration.md"
        }
      ]
    },
    {
      "id": "plan-locked-execution",
      "title": "Lock grounded plans before bounded model and harness execution",
      "status": "done",
      "priority": "high",
      "owner": "Orchestration maintainers",
      "target_date": null,
      "depends_on": [
        "bounded-peer-collaboration"
      ],
      "references": [
        {
          "path": "docs/pipeline-reference.md",
          "anchor": "plan-locked-execution"
        },
        {
          "path": "docs/pipeline-reference.md",
          "anchor": "provider-neutral-visual-game-harness-lane"
        }
      ]
    },
    {
      "id": "roadmap-truth-reset",
      "title": "Separate roadmap completion axes and replay exact local verifier contracts",
      "status": "done",
      "priority": "critical",
      "owner": "Forgewright maintainers",
      "target_date": null,
      "depends_on": [
        "docs-continuity"
      ],
      "references": [
        {
          "path": "docs/active-roadmap.md"
        }
      ]
    },
    {
      "id": "harness-host-contract",
      "title": "Specify and contract-test HarnessAdapter v1 lifecycle modes",
      "status": "done",
      "priority": "critical",
      "owner": "Runtime maintainers",
      "target_date": null,
      "depends_on": [
        "roadmap-truth-reset"
      ],
      "references": [
        {
          "path": "docs/active-roadmap.md"
        }
      ]
    },
    {
      "id": "trajectory-lifecycle",
      "title": "Add the canonical trajectory ledger and reversible lifecycle receipts",
      "status": "done",
      "priority": "critical",
      "owner": "Runtime maintainers",
      "target_date": null,
      "depends_on": [
        "harness-host-contract"
      ],
      "references": [
        {
          "path": "docs/active-roadmap.md"
        }
      ]
    },
    {
      "id": "execution-containment",
      "title": "Add filesystem, network, identity, and trust-boundary containment",
      "status": "done",
      "priority": "critical",
      "owner": "Runtime maintainers",
      "target_date": null,
      "depends_on": [
        "harness-host-contract",
        "trajectory-lifecycle"
      ],
      "references": [
        {
          "path": "docs/active-roadmap.md"
        }
      ]
    },
    {
      "id": "record-replay",
      "title": "Record, normalize, and strictly replay the full agent loop",
      "status": "done",
      "priority": "high",
      "owner": "Runtime maintainers",
      "target_date": null,
      "depends_on": [
        "trajectory-lifecycle",
        "execution-containment"
      ],
      "references": [
        {
          "path": "docs/active-roadmap.md"
        }
      ]
    },
    {
      "id": "production-evidence",
      "title": "Add provider adapters and complete paired live routing evidence",
      "status": "in_progress",
      "priority": "high",
      "owner": "Runtime maintainers",
      "target_date": null,
      "depends_on": [
        "record-replay"
      ],
      "references": [
        {
          "path": "docs/active-roadmap.md"
        }
      ]
    },
    {
      "id": "long-running-handoff",
      "title": "Add optional structured long-running handoff and fresh evaluation",
      "status": "planned",
      "priority": "medium",
      "owner": "Runtime maintainers",
      "target_date": null,
      "depends_on": [
        "production-evidence"
      ],
      "references": [
        {
          "path": "docs/active-roadmap.md"
        }
      ]
    },
    {
      "id": "evidence-trust-boundary",
      "title": "Harden completion evidence with exact acceptance/negative traceability, execution manifests, and keyless review binding",
      "status": "done",
      "priority": "critical",
      "owner": "Forgewright maintainers",
      "target_date": null,
      "depends_on": [
        "docs-continuity"
      ],
      "references": [
        {
          "path": "docs/pipeline-reference.md",
          "anchor": "evidence-schema-v2"
        }
      ]
    },
    {
      "id": "product-factory-pf0",
      "title": "PF0 — Reset product truth and remove instruction/heuristic entropy",
      "status": "done",
      "priority": "critical",
      "owner": "Forgewright maintainers",
      "target_date": null,
      "depends_on": [],
      "references": [
        {
          "path": "docs/active-roadmap.md",
          "anchor": "product-factory-upgrade-program"
        }
      ]
    },
    {
      "id": "product-factory-pf1",
      "title": "PF1 — Add the Product Intent Kernel and hierarchical Product Goal Graph",
      "status": "done",
      "priority": "critical",
      "owner": "Forgewright maintainers",
      "target_date": null,
      "depends_on": [
        "product-factory-pf0"
      ],